{
  "$schema": "https://raw.githubusercontent.com/son8x/ModelCompass/main/model-bank/schema.json",
  "version": "1.0.0",
  "exportedAt": "2026-09-18T11:46:23.7486836+07:00",
  "generatedBy": "Export-ModelBank.ps1",
  "sourceConfig": "configs/production/opencode.json",
  "providers": [
    {
      "id": "1-xkiro-free",
      "catalogId": "xkiro",
      "name": "1. xKiro Free (Best‑price multi‑model)",
      "npm": "@ai-sdk/openai-compatible",
      "baseURL": "https://api.xkiro.com/v1",
      "apiKeyEnv": "XTROUTER_API_KEY",
      "local": false
    },
    {
      "id": "2-xkiro-max",
      "catalogId": "xkiro",
      "name": "2. xKiro Max (Paid - gói Max)",
      "npm": "@ai-sdk/openai-compatible",
      "baseURL": "https://api.xkiro.com/v1",
      "apiKeyEnv": "XTROUTER_API_KEY",
      "local": false
    },
    {
      "_comment": "[TODO:OmniRoute] Provider hiện không sử dụng — đang dùng xKiro trực tiếp. Bỏ disabled khi cần phát triển lại.",
      "id": "3-omniroute-free",
      "catalogId": "omniroute",
      "name": "3. OmniRoute Free (Model mạnh nhất)",
      "npm": "@ai-sdk/openai-compatible",
      "baseURL": "http://127.0.0.1:20217/v1",
      "apiKeyEnv": "OMNIROUTE_KEY",
      "local": true,
      "disabled": true
    },
    {
      "_comment": "[TODO:OmniRoute] Provider hiện không sử dụng — đang dùng xKiro trực tiếp. Bỏ disabled khi cần phát triển lại.",
      "id": "4-openrouter-free",
      "catalogId": "openrouter",
      "name": "4. OpenRouter Free",
      "npm": "@ai-sdk/openai-compatible",
      "baseURL": "http://127.0.0.1:20217/v1",
      "apiKeyEnv": "OMNIROUTE_KEY",
      "local": true,
      "disabled": true
    },
    {
      "id": "5-9router",
      "catalogId": null,
      "name": "5. 9Router (local)",
      "npm": "@ai-sdk/openai-compatible",
      "baseURL": "http://127.0.0.1:20128/v1",
      "apiKeyEnv": "NINE_ROUTER_API_KEY",
      "local": true
    },
    {
      "id": "6-teamoRouter",
      "catalogId": "teamo",
      "name": "6. TeamoRouter (Discount & Thesis)",
      "npm": "@ai-sdk/openai-compatible",
      "baseURL": "https://api.teamorouter.cn/v1",
      "apiKeyEnv": "TEAMO_API_KEY",
      "local": false
    }
  ],
  "models": [
    {
      "provider": "1-xkiro-free",
      "id": "deepseek/deepseek-v4-pro",
      "releaseDate": "2099-12-31",
      "name": "DeepSeek V4 Pro (Reasoning + code mạnh nhất free · 1M ctx)",
      "pricing": null,
      "catalogPricing": null,
      "tags": []
    },
    {
      "provider": "1-xkiro-free",
      "id": "minimax/minimax-m3:free",
      "releaseDate": "2099-12-30",
      "name": "MiniMax M3 (Vision + reasoning · 1M ctx)",
      "pricing": null,
      "catalogPricing": {
        "input": 0.0,
        "output": 0.0
      },
      "tags": [
        "preset:safe-minimal"
      ]
    },
    {
      "provider": "1-xkiro-free",
      "id": "openai/gpt-5.3-codex-spark",
      "releaseDate": "2099-12-29",
      "name": "GPT-5.3 Codex Spark (Chuyên code · đang 503 tạm)",
      "pricing": null,
      "catalogPricing": {
        "input": 0.0,
        "output": 0.0
      },
      "tags": []
    },
    {
      "provider": "1-xkiro-free",
      "id": "deepseek/deepseek-v4.1-flash:free",
      "releaseDate": "2099-12-28",
      "name": "DeepSeek V4.1 Flash (Nhanh + vision · 1M ctx)",
      "pricing": null,
      "catalogPricing": null,
      "tags": []
    },
    {
      "provider": "1-xkiro-free",
      "id": "minimax/minimax-m2.7:free",
      "releaseDate": "2099-12-27",
      "name": "MiniMax M2.7 (Đa dụng cân bằng)",
      "pricing": null,
      "catalogPricing": {
        "input": 0.0,
        "output": 0.0
      },
      "tags": [
        "preset:safe-minimal"
      ]
    },
    {
      "provider": "1-xkiro-free",
      "id": "minimax/minimax-m2.7-highspeed:free",
      "releaseDate": "2099-12-26",
      "name": "MiniMax M2.7 Highspeed (Tốc độ cao)",
      "pricing": null,
      "catalogPricing": {
        "input": 0.0,
        "output": 0.0
      },
      "tags": []
    },
    {
      "provider": "1-xkiro-free",
      "id": "deepseek/deepseek-v4-flash",
      "releaseDate": "2099-12-25",
      "name": "DeepSeek V4 Flash (Nhanh, hợp tác agent · 1M ctx)",
      "pricing": null,
      "catalogPricing": null,
      "tags": []
    },
    {
      "provider": "1-xkiro-free",
      "id": "deepseek/deepseek-v3.2",
      "releaseDate": "2099-12-24",
      "name": "DeepSeek V3.2 (Đa dụng ổn định)",
      "pricing": null,
      "catalogPricing": null,
      "tags": []
    },
    {
      "provider": "1-xkiro-free",
      "id": "mistralai/codestral-2508",
      "releaseDate": "2099-12-23",
      "name": "Codestral 2508 (Chuyên code)",
      "pricing": null,
      "catalogPricing": {
        "input": 0.0,
        "output": 0.0
      },
      "tags": []
    },
    {
      "provider": "1-xkiro-free",
      "id": "minimax/minimax-m2.5:free",
      "releaseDate": "2099-12-22",
      "name": "MiniMax M2.5 (Cân bằng đa dụng)",
      "pricing": null,
      "catalogPricing": {
        "input": 0.0,
        "output": 0.0
      },
      "tags": []
    },
    {
      "provider": "1-xkiro-free",
      "id": "minimax/minimax-m2.5-highspeed:free",
      "releaseDate": "2099-12-21",
      "name": "MiniMax M2.5 Highspeed (Tốc độ cao)",
      "pricing": null,
      "catalogPricing": {
        "input": 0.0,
        "output": 0.0
      },
      "tags": []
    },
    {
      "provider": "1-xkiro-free",
      "id": "mistralai/devstral-medium",
      "releaseDate": "2099-12-20",
      "name": "Devstral Medium (Dev/code nhanh)",
      "pricing": null,
      "catalogPricing": {
        "input": 0.0,
        "output": 0.0
      },
      "tags": []
    },
    {
      "provider": "1-xkiro-free",
      "id": "deepseek/deepseek-chat-v3.1",
      "releaseDate": "2099-12-19",
      "name": "DeepSeek Chat V3.1 (Chat đa dụng)",
      "pricing": null,
      "catalogPricing": null,
      "tags": []
    },
    {
      "provider": "1-xkiro-free",
      "id": "mistralai/mistral-large-2512",
      "releaseDate": "2099-12-18",
      "name": "Mistral Large 2512 (Viết lách / paraphrase · 256K)",
      "pricing": null,
      "catalogPricing": {
        "input": 0.0,
        "output": 0.0
      },
      "tags": [
        "preset:safe-minimal"
      ]
    },
    {
      "provider": "1-xkiro-free",
      "id": "mistralai/mistral-medium-3.5",
      "releaseDate": "2099-12-17",
      "name": "Mistral Medium 3.5 (Cân bằng + vision)",
      "pricing": null,
      "catalogPricing": {
        "input": 0.0,
        "output": 0.0
      },
      "tags": []
    },
    {
      "provider": "1-xkiro-free",
      "id": "minimax/minimax-m2.1:free",
      "releaseDate": "2099-12-16",
      "name": "MiniMax M2.1 (Nền tảng ổn định)",
      "pricing": null,
      "catalogPricing": {
        "input": 0.0,
        "output": 0.0
      },
      "tags": []
    },
    {
      "provider": "1-xkiro-free",
      "id": "minimax/minimax-m2.1-highspeed:free",
      "releaseDate": "2099-12-15",
      "name": "MiniMax M2.1 Highspeed (Nhanh, tác vụ nhẹ)",
      "pricing": null,
      "catalogPricing": {
        "input": 0.0,
        "output": 0.0
      },
      "tags": []
    },
    {
      "provider": "1-xkiro-free",
      "id": "minimax/minimax-m2:free",
      "releaseDate": "2099-12-14",
      "name": "MiniMax M2 (Dòng M2 cũ nhất)",
      "pricing": null,
      "catalogPricing": {
        "input": 0.0,
        "output": 0.0
      },
      "tags": []
    },
    {
      "provider": "1-xkiro-free",
      "id": "mistralai/mistral-small-2603",
      "releaseDate": "2099-12-13",
      "name": "Mistral Small 2603 (Nhẹ, nhanh, vision)",
      "pricing": null,
      "catalogPricing": {
        "input": 0.0,
        "output": 0.0
      },
      "tags": []
    },
    {
      "provider": "1-xkiro-free",
      "id": "mistralai/ministral-14b",
      "releaseDate": "2099-12-12",
      "name": "Ministral 14B (Nhỏ, phản hồi nhanh)",
      "pricing": null,
      "catalogPricing": {
        "input": 0.0,
        "output": 0.0
      },
      "tags": []
    },
    {
      "provider": "1-xkiro-free",
      "id": "mistralai/ministral-8b",
      "releaseDate": "2099-12-11",
      "name": "Ministral 8B (Siêu nhẹ)",
      "pricing": null,
      "catalogPricing": {
        "input": 0.0,
        "output": 0.0
      },
      "tags": []
    },
    {
      "provider": "1-xkiro-free",
      "id": "mistralai/ministral-3b",
      "releaseDate": "2099-12-10",
      "name": "Ministral 3B (Nhẹ nhất, việc đơn giản)",
      "pricing": null,
      "catalogPricing": {
        "input": 0.0,
        "output": 0.0
      },
      "tags": []
    },
    {
      "provider": "1-xkiro-free",
      "id": "sensenova/sensenova-6.8-flash-lite",
      "releaseDate": "2099-12-09",
      "name": "SenseNova 6.8 Flash-Lite (Nhẹ + vision · đang 503 tạm)",
      "pricing": null,
      "catalogPricing": {
        "input": 0.0,
        "output": 0.0
      },
      "tags": []
    },
    {
      "provider": "1-xkiro-free",
      "id": "sensenova/sensenova-6.7-flash-lite",
      "releaseDate": "2099-12-08",
      "name": "SenseNova 6.7 Flash-Lite (Nhẹ, cơ bản)",
      "pricing": null,
      "catalogPricing": {
        "input": 0.0,
        "output": 0.0
      },
      "tags": []
    },
    {
      "provider": "2-xkiro-max",
      "id": "nvidia/nemotron-3-nano",
      "releaseDate": "2099-10-25",
      "name": "[B · Nhẹ/rẻ] Nemotron 3 Nano (In:$0.05 | Out:$0.20 · Rẻ nhất, 1M ctx)",
      "pricing": {
        "input": 0.05,
        "output": 0.2
      },
      "catalogPricing": {
        "input": 0.05,
        "output": 0.2
      },
      "tags": []
    },
    {
      "provider": "2-xkiro-max",
      "id": "nvidia/nemotron-3-super",
      "releaseDate": "2099-10-24",
      "name": "[B · Nhẹ/rẻ] Nemotron 3 Super (In:$0.08 | Out:$0.45 · 1M ctx siêu rẻ · khuyến nghị)",
      "pricing": {
        "input": 0.08,
        "output": 0.45
      },
      "catalogPricing": {
        "input": 0.08,